question,answer
"Apa arti ""Reuse"" dalam konsep 3R?","""Reuse"" itu artinya menggunakan kembali barang-barang yang masih layak pakai, daripada langsung dibuang. Jadi, kita kasih kesempatan kedua buat barang tersebut sebelum jadi sampah."
"Berikan contoh praktik ""Reuse"" yang bisa dilakukan di rumah!","Banyak kok! Misalnya, pakai botol kaca bekas buat simpan cairan, ubah pakaian lama jadi tas atau lap kain, bungkus kado pakai kain atau koran bekas, atau sumbangin barang bekas yang masih layak pakai."
"Apa itu ""Recycle"" dalam 3R?","""Recycle"" itu proses mengubah limbah jadi produk baru yang berguna. Biasanya sih lewat proses industri atau pengolahan skala rumah tangga. Jadi, sampah diolah lagi biar punya manfaat baru."
"Sebutkan contoh hasil dari proses ""Recycle""!",Contohnya banyak! Kertas bekas bisa jadi kertas daur ulang atau kerajinan. Botol plastik bisa diubah jadi benang sintetis buat pakaian. Kaleng bekas bisa jadi bahan baku logam lagi. Sampah organik juga bisa jadi kompos buat tanaman.
Apa yang dimaksud dengan Eco-Living atau Gaya Hidup Ramah Lingkungan?,"Eco-Living itu gaya hidup yang memperhatikan keberlanjutan lingkungan dalam setiap aspek kehidupan kita. Intinya, kita berusaha hidup selaras dengan alam dan mengurangi dampak negatif ke bumi."
Bagaimana cara menerapkan konsumsi bijak dalam Eco-Living?,"Konsumsi bijak itu misalnya memilih produk lokal, organik, dan yang enggak pakai bahan kimia berbahaya. Dengan begitu, kita mendukung praktik yang lebih ramah lingkungan dan kesehatan."
Apa saja contoh transportasi ramah lingkungan?,"Kamu bisa pilih naik sepeda, jalan kaki, atau pakai transportasi umum. Ini semua bantu mengurangi emisi karbon dibandingkan pakai kendaraan pribadi terus-menerus."
Bagaimana cara hemat energi dan air dalam gaya hidup Eco-Living?,"Gampang kok! Matikan lampu kalau enggak dipakai, gunakan peralatan elektronik yang hemat energi. Untuk air, pakai secukupnya aja dan kalau ada keran bocor, segera perbaiki ya!"
Apa itu Zero Waste Lifestyle?,"Zero Waste Lifestyle itu pendekatan gaya hidup buat enggak menghasilkan sampah yang akhirnya cuma berakhir di TPA (Tempat Pembuangan Akhir). Tujuannya, meminimalkan sampah sebisa mungkin."
Ada berapa prinsip utama dalam Zero Waste Lifestyle? Sebutkan!,"Ada 5 prinsip utama dalam Zero Waste Lifestyle, yaitu Refuse (Tolak), Reduce (Kurangi), Reuse (Gunakan kembali), Recycle (Daur ulang), dan Rot (Kompos). Mudah diingat kan, 5R!"
"Jelaskan prinsip ""Refuse"" (Tolak) dalam Zero Waste!","Prinsip ""Refuse"" itu artinya menolak barang-barang yang sebenarnya enggak kita perlukan. Contohnya, menolak brosur, plastik pembungkus yang enggak penting, atau hadiah promosi yang cuma bakal jadi sampah."
"Apa bedanya ""Reduce"" di 3R dengan ""Reduce"" di Zero Waste Lifestyle?","Sebenarnya konsepnya sama, yaitu mengurangi jumlah barang yang kita beli dan gunakan. Baik di 3R maupun Zero Waste, ""Reduce"" ini penting banget buat mencegah timbulnya sampah dari awal."
"Bagaimana prinsip ""Reuse"" diterapkan dalam Zero Waste?","Prinsip ""Reuse"" dalam Zero Waste itu berarti menggunakan kembali barang-barang selama mungkin sebelum akhirnya dibuang atau didaur ulang. Jadi, maksimalkan usia pakai barang yang kita punya."
"Kapan prinsip ""Recycle"" digunakan dalam filosofi Zero Waste?","Dalam Zero Waste, ""Recycle"" itu jadi pilihan kalau barangnya udah enggak bisa ditolak, dikurangi, atau digunakan kembali. Jadi, kalau memang harus jadi sampah, upayakan untuk didaur ulang jadi sesuatu yang baru."
"Apa yang dimaksud dengan ""Rot"" (Kompos) dalam Zero Waste Lifestyle?","""Rot"" itu artinya mengomposkan sampah organik, kayak sisa makanan dan daun kering. Dengan dikomposkan, sampah organik bisa kembali ke alam sebagai pupuk yang menyuburkan tanah, bukan malah menumpuk di TPA."
Mengapa menghindari produk dengan mikroplastik penting dalam Eco-Living?,"Penting banget! Mikroplastik itu partikel plastik super kecil yang bisa mencemari lingkungan, terutama lautan, dan masuk ke rantai makanan. Memilih kosmetik dan pembersih alami yang bebas mikroplastik bantu mengurangi masalah ini."
Apa tujuan dari Panduan EcoSortify?,"Panduan EcoSortify dirancang buat ngebekali kamu dengan pengetahuan dan keterampilan buat ngenali, milah, dan ngelola sampah secara bijak. Tujuannya biar kesadaran lingkungan kita meningkat lewat cara yang interaktif."
Bagaimana fitur Edukasi Jenis Sampah di EcoSortify membantu pengguna?,"Fitur ini ngebantu kamu pelajari berbagai jenis sampah lewat klasifikasi otomatis dari gambar yang kamu unggah. EcoSortify pakai teknologi AI buat identifikasi jenis sampah kayak organik, anorganik, B3, dan daur ulang."
Informasi apa saja yang bisa didapatkan pengguna dari fitur klasifikasi visual EcoSortify?,"Kamu bisa dapat info lengkap soal ciri-ciri fisik tiap jenis sampah, dampak lingkungannya kalau enggak ditangani dengan benar, dan cara terbaik buat mendaur ulang atau membuangnya. Lengkap deh!"
Apa fungsi Chatbot Asisten Pengetahuan Sampah di EcoSortify?,"Chatbot ini dirancang khusus jadi asisten edukatif kamu soal pengelolaan sampah. Kamu bisa tanya apa aja seputar jenis, pengolahan, dan dampak sampah. Chatbot siap bantu jawab!"
Apa saja yang bisa dilakukan pengguna dengan Chatbot Asisten Pengetahuan Sampah?,"Banyak! Kamu bisa ajukan pertanyaan soal sampah, dapat saran pemilahan berdasarkan jenis material (misalnya plastik PET, kertas, logam), dapat tips eco-friendly, dan belajar konsep 3R secara praktis."
Apakah Chatbot EcoSortify bisa memberikan tips eco-friendly?,"Tentu saja! Salah satu fitur chatbot kami adalah memberikan tips-tips eco-friendly yang bisa kamu terapkan dalam kehidupan sehari-hari. Jadi, hidup lebih ramah lingkungan jadi lebih mudah!"
Bisakah saya belajar konsep 3R melalui chatbot EcoSortify?,"Iya, bisa banget! Chatbot EcoSortify akan membantu kamu belajar konsep reduce, reuse, recycle (3R) secara praktis. Kamu bisa tanya-tanya dan dapat penjelasan yang mudah dipahami."
Kapan saya bisa mengakses chatbot EcoSortify?,"Chatbot kami tersedia 24/7, jadi kamu bisa akses kapan aja butuh bantuan atau informasi soal sampah. Selalu siap sedia buat kamu!"
Apakah informasi dari chatbot EcoSortify selalu update?,"Betul! Chatbot kami terus diperbarui berdasarkan data serta praktik terbaik dalam pengelolaan sampah. Jadi, informasi yang kamu dapatkan selalu relevan dan terkini."
Apa itu kompos?,"Kompos itu pupuk organik yang dihasilkan dari proses penguraian bahan-bahan organik. Contoh bahan organiknya seperti sisa makanan, daun-daunan, atau potongan sayur dan buah."
Bagaimana proses pembuatan kompos secara sederhana?,"Prosesnya gini: sampah organik dikumpulkan, terus dibiarin terurai secara alami dengan bantuan mikroorganisme. Nanti, sampah organik itu bakal berubah jadi pupuk yang kaya nutrisi buat tanaman."
Apa saja manfaat membuat kompos dari sampah organik?,"Manfaatnya banyak! Pertama, mengurangi volume sampah organik. Kedua, menghasilkan pupuk alami buat pertanian atau kebun. Ketiga, mengurangi kebutuhan pupuk kimia. Keren kan?"
Apa itu biogas?,"Biogas itu gas yang dihasilkan dari fermentasi bahan organik dalam kondisi tanpa oksigen (anaerob). Gas utamanya itu metana dan karbon dioksida. Biasanya bahan organiknya bisa dari sisa makanan, kotoran hewan, atau limbah pertanian."
Bahan organik apa saja yang bisa diolah menjadi biogas?,"Banyak jenis bahan organik yang bisa, misalnya sisa makanan, kotoran hewan, dan limbah pertanian. Bahan-bahan ini akan difermentasi untuk menghasilkan biogas."
Bagaimana proses sampah organik diubah menjadi biogas?,"Jadi, sampah organik itu dimasukkan ke dalam reaktor biogas. Di sana, sampah akan difermentasi oleh mikroorganisme. Proses fermentasi ini menghasilkan gas metana, yang kemudian bisa dipakai sebagai bahan bakar atau buat listrik."
Apa saja manfaat dari pemanfaatan biogas?,"Manfaatnya oke banget! Biogas itu sumber energi alternatif terbarukan. Terus, bisa mengurangi emisi gas rumah kaca dari sampah organik, dan meminimalkan pencemaran air serta bau dari limbah organik."
Apakah biogas ramah lingkungan?,"Iya, biogas termasuk sumber energi yang lebih ramah lingkungan. Selain menghasilkan energi, prosesnya juga membantu mengurangi volume sampah organik dan emisi gas metana ke atmosfer jika sampah tersebut hanya dibiarkan membusuk di TPA."
Sampah organik itu sebenarnya apa sih?,Sampah organik itu sampah yang berasal dari bahan-bahan hayati atau makhluk hidup. Sampah jenis ini bisa terurai secara alami oleh mikroorganisme. Contohnya banyak dari sampah rumah tangga dan pasar tradisional.
Dari mana sumber utama sampah organik?,"Sumber utama sampah organik itu kebanyakan dari sampah rumah tangga dan pasar tradisional. Misalnya sayuran, buah-buahan, sisa makanan, dan sejenisnya."
Apa karakteristik utama dari sampah organik?,"Karakteristik utamanya itu mudah membusuk dan mudah terurai melalui proses alami. Artinya, penguraiannya bisa terjadi tanpa campur tangan manusia, cukup oleh mikroorganisme saja."
Kenapa sampah organik tidak disarankan dibuang ke TPA?,"Soalnya, kalau dibuang ke TPA, sampah organik bisa menyebabkan pencemaran air dan tanah. Selain itu, bisa bikin sampah jenis lain jadi tercampur dan susah diolah. Bahkan, beberapa daerah sudah mulai melarang pembuangan sampah organik ke TPA, lho!"
Apa kebijakan TPA Sarimukti Jawa Barat terkait sampah organik?,"TPA Sarimukti di Jawa Barat sudah menerapkan kebijakan untuk melarang sampah organik dibuang ke TPA sejak 1 Januari 2024. Rencananya, aturan ini akan diterapkan bertahap di berbagai daerah lain juga."
Apa saja yang akan dibahas terkait cara pembuangan sampah organik yang benar?,"Kita akan belajar banyak hal, mulai dari mengenal jenis-jenis sampah organik sampai metode pembuangan yang baik dan benar. Jadi, kamu bakal tahu cara ngelola sampah organik dengan tepat!"
Ada berapa jenis sampah organik? Sebutkan!,"Sampah organik itu ada dua jenis utama, yaitu sampah organik basah dan sampah organik kering. Keduanya beda di kandungan air dan waktu penguraiannya."
Apa ciri-ciri sampah organik basah?,"Sampah organik basah itu punya kandungan air yang cukup tinggi. Makanya, jenis ini cepat membusuk dan sering menimbulkan bau tak sedap. Waktu penguraiannya sekitar 2 hari sampai 2 minggu, tergantung kondisi lingkungan."
Berikan contoh sampah organik basah!,"Contoh sampah organik basah itu antara lain buah-buahan, sayur-sayuran, kotoran hewan, dan sisa makanan. Pokoknya yang basah-basah dan gampang busuk."
Bagaimana dengan sampah organik kering? Apa bedanya dengan yang basah?,"Sampah organik kering itu kadar airnya lebih sedikit. Jadi, dia cenderung lebih lama terurainya dibandingkan sampah organik basah. Tapi, tetap bisa terurai oleh mikroorganisme kok."
Berapa lama waktu penguraian sampah organik kering?,"Waktu penguraian sampah organik kering itu sekitar 1 bulan sampai 6 bulan. Lamanya tergantung jenis sampah dan kondisinya, misalnya ukuran dan ketebalannya."
Apa saja contoh sampah organik kering?,"Contohnya itu dedaunan kering, ranting pohon, dan kayu. Yang kering-kering dan butuh waktu lebih lama buat terurai."
Apa cara paling mudah dan praktis untuk membuang sampah organik menurut artikel?,"Menurut artikel ini, cara paling mudah dan praktis itu dengan mengolahnya jadi pupuk kompos sederhana. Gampang dilakukan dan manfaatnya banyak!"
Bagaimana cara membuat kompos dengan metode lubang di tanah?,"Caranya, buat lubang di tanah, usahakan di area yang teduh. Masukkan sampah organik ke lubang itu, lalu tutup lagi dengan tanah. Proses dekomposisi akan terjadi secara alami."
Berapa lama proses dekomposisi sampah organik di lubang tanah?,"Prosesnya berlangsung sekitar 1 minggu sampai 3 bulan. Lamanya tergantung volume dan jenis sampah yang kamu masukkan. Selain mengurangi limbah, cara ini juga bisa menyuburkan tanah, lho!"
Bagaimana cara membuat kompos di wadah tertutup seperti ember atau tong?,"Pertama, buat lapisan dasar pakai tanah. Terus, tambahkan sampah organik. Tutup lagi dengan lapisan tanah. Kamu bisa tambahkan EM4 atau air cucian beras sebagai starter biar fermentasinya lebih cepat. Terakhir, tutup wadahnya rapat tapi kasih sedikit celah udara buat proses aerobik."
Apa fungsi EM4 atau air cucian beras dalam pembuatan kompos?,"EM4 (Effective Microorganisms) atau air cucian beras itu berfungsi sebagai starter. Maksudnya, buat mempercepat proses fermentasi sampah organik jadi kompos. Jadi, komposnya lebih cepat jadi!"
Kenapa wadah kompos perlu diberi celah udara kecil?,Celah udara kecil itu penting untuk proses aerobik. Proses aerobik butuh oksigen supaya mikroorganisme bisa bekerja dengan baik menguraikan sampah organik jadi kompos.
Berapa lama waktu yang dibutuhkan untuk proses pembuatan kompos di wadah?,"Proses pembuatan kompos di wadah ini juga butuh waktu antara 1 minggu sampai 3 bulan, sama seperti metode lubang. Lamanya tergantung volume sampah dan kondisi lingkungannya."
Apa alternatif lain jika tidak punya waktu atau tempat mengolah sampah organik sendiri?,"Tenang, ada alternatifnya kok! Kamu bisa menyetorkan sampah organik ke Bank Sampah Organik atau memberikannya kepada peternak."
Bagaimana cara kerja pembuangan sampah organik melalui bank sampah?,"Kamu bisa menyetorkan sampah organikmu ke bank sampah organik. Nanti, pihak bank sampah yang akan memprosesnya. Cukup mudah dan praktis, kan? Jangan lupa cek info bank sampah organik di kotamu ya!"
Apakah semua jenis sampah organik bisa diberikan ke peternak?,"Enggak semua, ya. Hanya sampah organik tertentu seperti buah-buahan dan sayuran segar yang masih layak konsumsi yang bisa diberikan ke peternak sebagai pakan. Pastikan enggak busuk atau tercampur bahan kimia."
Di mana metode memberikan sampah organik ke peternak ini cocok diterapkan?,"Metode ini cocok banget diterapkan di pasar tradisional. Soalnya, di pasar sering banyak buah dan sayuran yang terbuang padahal masih layak buat pakan hewan."
Apa syarat sampah organik yang bisa diberikan sebagai pakan ternak?,"Syaratnya, sampah organik itu harus masih segar dan layak konsumsi. Jangan yang sudah busuk atau tercampur bahan kimia berbahaya ya, kasihan ternaknya nanti."
Kenapa pasar tradisional menjadi lokasi yang ideal untuk praktik pemberian sampah organik ke peternak?,"Karena di pasar tradisional seringkali banyak buah dan sayuran yang tidak terjual atau sedikit layu, namun sebenarnya masih sangat layak untuk dijadikan pakan ternak. Ini bisa mengurangi sampah pasar sekaligus memberi makan ternak."
Apa itu sampah anorganik?,"Sampah anorganik itu jenis sampah yang enggak berasal dari makhluk hidup. Umumnya, sampah ini sulit terurai secara alami dan seringnya berasal dari hasil industri atau kegiatan manusia sehari-hari."
Dari mana biasanya sampah anorganik berasal?,"Sampah anorganik sering berasal dari hasil industri atau kegiatan kita sehari-hari, contohnya seperti plastik, kaca, dan logam."
Apakah sampah anorganik bisa membusuk?,"Enggak, sampah anorganik itu enggak membusuk. Tapi, kabar baiknya, banyak jenis sampah anorganik yang bisa didaur ulang atau dimanfaatkan kembali jadi barang baru yang berguna."
Apa yang dimaksud dengan sampah anorganik yang dapat didaur ulang?,"Itu artinya sampah anorganik tersebut masih bisa digunakan kembali atau diolah jadi produk baru melalui proses daur ulang. Jadi, enggak langsung berakhir jadi sampah tak berguna."
Sebutkan contoh sampah anorganik yang bisa didaur ulang!,"Contohnya banyak! Ada botol plastik, kaleng minuman, kertas koran, kaca bekas, dan kardus. Semua ini bisa diolah lagi jadi sesuatu yang baru."
Apa manfaat mendaur ulang sampah anorganik?,"Manfaatnya keren banget! Bisa mengurangi volume sampah, menghemat bahan baku baru, dan memberikan nilai ekonomi karena bisa dijual ke pengepul atau bank sampah."
Apa itu sampah anorganik yang tidak dapat didaur ulang?,"Itu sampah anorganik yang udah rusak, tercampur bahan kimia berbahaya, atau emang enggak punya nilai guna lagi sehingga enggak bisa diolah kembali. Sayang banget ya."
Berikan contoh sampah anorganik yang sulit atau tidak bisa didaur ulang!,"Contohnya itu styrofoam bekas makanan, popok sekali pakai, plastik berlapis aluminium kayak kemasan snack, dan sedotan plastik sekali pakai. Makanya, lebih baik dikurangi penggunaannya."
Kenapa penggunaan sampah anorganik yang tidak bisa didaur ulang sebaiknya dikurangi?,"Soalnya, jenis sampah ini penguraiannya bisa makan waktu sampai ratusan tahun! Jadi, kalau kita kurangi penggunaannya dari awal (reduce), kita bantu banget mengurangi masalah sampah jangka panjang."
Bagaimana metode pembuangan untuk sampah anorganik yang bisa didaur ulang?,"Sampah anorganik yang bisa didaur ulang seperti botol plastik, kardus, dan kaleng itu bisa dipilah, dibersihkan, terus dijual ke pengepul atau disetorkan ke bank sampah buat di-recycle."
Langkah-langkah apa saja yang perlu dilakukan sebelum menyetorkan sampah anorganik untuk didaur ulang?,"Pertama, cuci bersih dulu sampah anorganiknya. Kedua, keringkan sebelum disimpan. Ketiga, pisahkan berdasarkan jenisnya, misalnya plastik sendiri, logam sendiri, kertas sendiri. Terakhir, baru deh setorkan ke bank sampah atau pengelola daur ulang."
Apa manfaat dari memilah dan menyetorkan sampah anorganik ke bank sampah?,Manfaat utamanya adalah mengurangi jumlah sampah yang berakhir di TPA. Ini penting banget buat menjaga lingkungan kita tetap bersih dan sehat.
"Selain didaur ulang (recycling), apa lagi yang bisa dilakukan dengan sampah anorganik?","Selain di-recycle, sampah anorganik juga bisa di-upcycle! Upcycling itu kreasi ulang sampah jadi produk baru yang unik dan berguna, bahkan bisa punya nilai lebih."
Apa itu upcycling?,"Upcycling itu memanfaatkan kembali barang anorganik menjadi produk baru yang unik dan berguna. Jadi, barang bekas diubah jadi sesuatu yang punya nilai fungsi atau estetika baru."
Bisa kasih contoh hasil upcycling dari sampah anorganik?,"Tentu! Misalnya, botol plastik jadi pot tanaman, kaleng bekas jadi tempat alat tulis, CD bekas jadi hiasan dinding, atau kemasan sabun jadi tas daur ulang yang keren. Kreatif kan?"
Apa saja manfaat dari kegiatan upcycling?,"Manfaatnya banyak! Bisa meningkatkan kreativitas kita, mengurangi biaya beli barang baru, dan memperpanjang usia pakai barang. Jadi, barang enggak cepat jadi sampah."
Bagaimana cara kerja bank sampah untuk sampah anorganik?,"Bank sampah itu menampung sampah anorganik yang sudah kamu pilah. Nanti, sampah itu akan dijual atau dikirim ke industri daur ulang. Kamu juga bisa dapat nilai tabungan dari sampah yang kamu setorkan, lho!"
Apa yang kita dapatkan jika menyetorkan sampah anorganik ke bank sampah?,"Kamu akan mendapatkan nilai tabungan! Besarnya tergantung berat dan jenis sampah anorganik yang kamu setorkan. Jadi, selain bantu lingkungan, bisa nambah tabungan juga."
Apa tips agar bisa rutin menyetor sampah ke bank sampah?,"Tipsnya, pertama, daftar dulu jadi nasabah bank sampah terdekat. Kedua, pelajari jenis sampah apa aja yang diterima sama bank sampah itu. Ketiga, rajin memilah dan mencatat setoran sampahmu."
Mengapa penting untuk mengetahui jenis sampah yang diterima oleh bank sampah?,"Penting banget! Soalnya, tiap bank sampah mungkin punya aturan sendiri soal jenis sampah anorganik yang mereka terima dan olah. Biar sampahmu enggak ditolak, pastikan kamu tahu dulu ya."
Apa definisi dari Sampah B3?,"Sampah B3 itu adalah limbah yang mengandung bahan beracun dan berbahaya bagi manusia, hewan, dan lingkungan. Makanya, jenis sampah ini butuh penanganan khusus."
Kenapa sampah B3 perlu penanganan khusus?,Karena sampah B3 bisa menyebabkan pencemaran serius dan penyakit kalau dibuang sembarangan. Kandungan bahan beracun dan berbahayanya itu yang bikin dia beda dari sampah biasa.
Sebutkan contoh-contoh sampah B3 yang sering ada di rumah!,"Contohnya itu baterai bekas (AA, AAA, baterai ponsel), lampu neon dan bohlam, obat kedaluwarsa, cat dan tinta printer, kosmetik dan skincare bekas, pestisida dan insektisida, serta termometer raksa."
Apa saja bahaya dari sampah B3?,"Sampah B3 itu bisa bersifat racun karena mengandung logam berat seperti merkuri atau timbal. Bisa juga korosif, artinya menyebabkan luka bakar kalau kena kulit. Ada juga yang reaktif, gampang meledak atau bereaksi dengan bahan lain, dan karsinogenik atau memicu kanker."
Bagaimana cara menangani sampah B3 yang benar?,"Pertama, pisahkan sampah B3 dari sampah lain. Gunakan wadah khusus yang dikasih label ""Sampah B3"". Jangan dicampur sama sampah organik atau anorganik biasa ya!"
Apa bahaya merkuri dalam sampah B3?,"Merkuri itu termasuk logam berat yang sangat beracun. Kalau masuk ke lingkungan atau tubuh kita, bisa menyebabkan berbagai masalah kesehatan serius, terutama pada sistem saraf. Makanya, sampah yang mengandung merkuri seperti termometer raksa harus ditangani hati-hati."
Apa maksudnya sampah B3 bersifat korosif?,"Bersifat korosif artinya sampah B3 tersebut bisa merusak atau menghancurkan bahan lain melalui reaksi kimia, termasuk kulit kita. Kalau kena kulit, bisa menyebabkan luka bakar. Jadi, hati-hati ya saat menanganinya!"
Apa arti sampah B3 yang reaktif?,"Sampah B3 yang reaktif itu artinya dia gampang banget bereaksi secara kimia. Bisa jadi mudah meledak, terbakar, atau menghasilkan gas beracun kalau kontak dengan bahan lain atau dalam kondisi tertentu."
Apa itu sampah B3 karsinogenik?,Sampah B3 karsinogenik itu mengandung zat-zat yang bisa memicu atau meningkatkan risiko terjadinya kanker pada manusia atau hewan. Serem ya!
Ke mana kita bisa menyetorkan sampah B3 rumah tangga?,"Kamu bisa setorkan ke TPS3R (Tempat Pengolahan Sampah Reduce, Reuse, Recycle) atau dinas lingkungan hidup di kotamu. Beberapa kota juga menyediakan TPS khusus atau dropbox untuk limbah B3 rumah tangga di kantor DLH, mal, atau pusat daur ulang."
"Bagaimana jika jumlah limbah B3 sangat besar, misalnya dari industri?","Kalau jumlahnya besar, seperti dari sekolah, rumah sakit, atau industri, wajib pakai jasa pengangkut dan pengolah limbah B3 yang sudah resmi terdaftar di KLHK (Kementerian Lingkungan Hidup dan Kehutanan)."
Apa saja hal yang TIDAK BOLEH dilakukan terhadap sampah B3?,"Jangan pernah membuang baterai ke tong sampah biasa, mencuci limbah cat ke saluran air, atau membakar limbah B3. Ini semua berbahaya buat lingkungan dan kesehatan."
Bagaimana cara mengurangi sampah B3 dari penggunaan baterai?,"Salah satu caranya adalah dengan menggunakan baterai isi ulang (rechargeable). Jadi, kamu enggak perlu sering-sering beli dan buang baterai sekali pakai."
"Selain baterai isi ulang, apa lagi upaya mengurangi sampah B3 di rumah?","Kamu bisa kurangi pemakaian pestisida kimia dan ganti dengan cara alami. Selain itu, pilih produk-produk yang ramah lingkungan dan bebas bahan kimia berbahaya."
Di mana biasanya dropbox untuk limbah B3 seperti baterai bekas bisa ditemukan?,"Dropbox untuk limbah B3 seperti baterai atau lampu bekas biasanya tersedia di kantor Dinas Lingkungan Hidup (DLH), beberapa mal, atau pusat daur ulang. Coba cek di kotamu ya!"
Mengapa membakar limbah B3 itu dilarang?,Membakar limbah B3 itu sangat berbahaya karena bisa melepaskan zat-zat beracun dan polutan berbahaya ke udara. Ini bisa mencemari udara yang kita hirup dan berdampak buruk bagi kesehatan serta lingkungan.
Bagaimana memilih produk untuk mengurangi sampah B3?,"Salah satu caranya adalah dengan memilih produk yang tanpa kemasan berlebihan. Semakin sedikit kemasan, semakin sedikit potensi sampah yang dihasilkan, termasuk yang mungkin mengandung B3."
Apa perbedaan mendasar antara sampah organik dan anorganik?,"Perbedaan utamanya, sampah organik berasal dari makhluk hidup dan bisa terurai alami, contohnya sisa makanan. Kalau sampah anorganik enggak berasal dari makhluk hidup dan sulit terurai alami, contohnya plastik."
Mengapa pemilahan sampah di sumbernya (di rumah) itu penting?,"Penting banget! Kalau sampah sudah dipilah dari rumah, proses daur ulang dan pengolahannya jadi lebih mudah dan efektif. Sampah yang tercampur jadi susah diolah dan nilainya turun."
"Saya punya banyak botol plastik bekas, sebaiknya diapakan ya?","Botol plastik bekas itu termasuk sampah anorganik yang bisa didaur ulang! Kamu bisa kumpulkan, bersihkan, lalu setorkan ke bank sampah atau pengelola daur ulang. Bisa juga kamu kreasikan jadi pot tanaman atau tempat pensil (upcycling)!"
Sisa sayuran dan kulit buah sebaiknya saya buang ke mana?,"Sisa sayuran dan kulit buah itu sampah organik basah. Jangan dibuang ke TPA ya! Lebih baik diolah jadi kompos di rumah, atau kalau ada, bisa disetorkan ke bank sampah organik atau diberikan ke peternak sebagai pakan."
Apakah styrofoam bisa didaur ulang?,"Sayangnya, styrofoam itu termasuk jenis plastik yang sulit atau bahkan enggak bisa didaur ulang dengan teknologi yang ada saat ini. Makanya, lebih baik kita kurangi penggunaannya ya."
Bagaimana cara mengetahui apakah suatu kemasan plastik bisa didaur ulang atau tidak?,Coba perhatikan simbol daur ulang (biasanya segitiga dengan angka di tengah) dan kode plastiknya. Edukasi soal simbol ini penting biar kita bisa memilah dengan tepat. Kamu bisa cari tahu arti kode-kode tersebut.
Apa dampak negatif jika sampah tidak dikelola dengan baik secara umum?,"Wah, dampaknya banyak! Bisa menyebabkan pencemaran lingkungan (tanah, air, udara), menimbulkan bau tak sedap, jadi sarang penyakit, dan merusak keindahan. Makanya, pengelolaan sampah yang baik itu penting banget."
Apa itu TPA dan mengapa kita harus berusaha mengurangi sampah yang masuk ke sana?,"TPA itu Tempat Pembuangan Akhir. Kita harus berusaha mengurangi sampah ke TPA karena kapasitas TPA terbatas. Selain itu, tumpukan sampah di TPA bisa menghasilkan gas metana (gas rumah kaca) dan mencemari lingkungan."
"Bagaimana prinsip ""Reduce"" bisa membantu mengurangi sampah di TPA?","Prinsip ""Reduce"" itu kan mengurangi konsumsi barang dari awal. Kalau kita lebih sedikit mengonsumsi, otomatis sampah yang dihasilkan juga lebih sedikit. Jadi, sampah yang perlu dibuang ke TPA pun berkurang."
