question,answer
Bisakah sampah elektronik seperti HP rusak dikategorikan sebagai B3?,"Iya, betul. Sampah elektronik atau e-waste, termasuk HP rusak, seringkali mengandung komponen B3 seperti logam berat. Jadi, enggak boleh dibuang sembarangan dan perlu penanganan khusus."
Apa peran masyarakat dalam keberhasilan program 3R?,"Peran masyarakat sangat besar! Keberhasilan 3R itu dimulai dari kesadaran dan partisipasi aktif setiap individu untuk mengurangi (reduce), menggunakan kembali (reuse), dan mendaur ulang (recycle) sampahnya."
Apakah EcoSortify hanya untuk klasifikasi sampah visual saja?,"Enggak cuma itu! Selain klasifikasi visual jenis sampah, EcoSortify juga punya Chatbot Asisten Pengetahuan Sampah yang bisa jawab pertanyaanmu, kasih saran pemilahan, dan tips eco-friendly."
Bagaimana cara membuat kompos dari daun kering?,"Daun kering itu sampah organik kering, bagus banget buat kompos! Kamu bisa campurkan dengan sampah organik basah (seperti sisa sayuran) dalam komposter atau lubang biopori. Daun kering bantu memberi tekstur dan karbon pada kompos."
Apa beda kompos dan biogas sebagai hasil olahan sampah organik?,"Kompos itu hasil penguraian sampah organik jadi pupuk padat yang kaya nutrisi buat tanaman. Kalau biogas itu gas (utamanya metana) hasil fermentasi sampah organik dalam kondisi tanpa oksigen, bisa dipakai sebagai bahan bakar."
Apakah semua sampah organik menghasilkan bau tak sedap?,Enggak selalu. Sampah organik basah seperti sisa makanan memang cenderung cepat busuk dan bau kalau enggak diolah benar. Tapi sampah organik kering seperti daun kering atau ranting biasanya enggak terlalu bau. Pengomposan yang benar juga bisa mengurangi bau.
Kenapa sampah medis seperti jarum suntik sangat berbahaya jika dibuang sembarangan?,"Jarum suntik bekas itu limbah medis infeksius yang tajam. Kalau dibuang sembarangan, bisa melukai orang dan menularkan penyakit serius seperti Hepatitis atau HIV kepada siapa saja yang tidak sengaja tertusuk."
Apa yang harus saya lakukan dengan obat kedaluwarsa?,"Obat kedaluwarsa termasuk sampah B3. Jangan dibuang ke toilet atau tempat sampah biasa ya. Sebaiknya hancurkan dulu (misalnya tablet digerus, campur dengan ampas kopi atau tanah biar enggak disalahgunakan), lalu kumpulkan dan serahkan ke fasilitas pengelola limbah B3 atau apotek yang menerima."
Apakah bank sampah menerima semua jenis sampah?,"Umumnya bank sampah fokus menerima sampah anorganik yang punya nilai jual dan bisa didaur ulang, seperti plastik, kertas, logam, kaca. Beberapa bank sampah ada juga yang khusus menerima sampah organik. Sebaiknya tanyakan dulu ke bank sampah terdekat jenis apa saja yang mereka terima."
Bagaimana cara memulai gaya hidup Zero Waste bagi pemula?,"Mulai dari yang kecil! Coba terapkan prinsip Refuse (tolak yang tidak perlu) dan Reduce (kurangi konsumsi). Bawa tas belanja sendiri, botol minum sendiri. Pelan-pelan nanti bisa lanjut ke Reuse, Recycle, dan Rot."
Apakah EcoSortify bisa membantu saya membedakan jenis plastik PET dan PP?,"Chatbot Asisten Pengetahuan Sampah di EcoSortify bisa memberikanmu informasi dan saran pemilahan berdasarkan jenis material, termasuk membantu mengenali perbedaan dan cara pengelolaan plastik PET atau PP."
Apa keuntungan ekonomi dari mengelola sampah dengan benar?,"Sampah yang dipilah dan bersih, terutama anorganik, punya nilai jual ke pengepul atau bank sampah. Ini bisa jadi tambahan penghasilan. Mengompos juga mengurangi pengeluaran beli pupuk. Jadi, ada nilai ekonominya juga!"
Mengapa penting untuk tidak mencampur sampah organik basah dengan sampah anorganik yang akan didaur ulang?,"Karena sampah organik basah bisa mengkontaminasi sampah anorganik, membuatnya kotor, bau, dan sulit didaur ulang. Akibatnya, nilai sampah anorganik itu jadi turun atau bahkan tidak bisa diproses lagi."
"Apa itu ""gerakan peduli lingkungan"" yang disebutkan terkait bank sampah?","Maksudnya, bank sampah itu bukan cuma tempat nabung sampah, tapi juga jadi simbol dan sarana untuk meningkatkan kesadaran dan tindakan nyata masyarakat dalam menjaga kebersihan dan kelestarian lingkungan melalui pengelolaan sampah yang lebih baik."
Apa bahaya gas metana yang dihasilkan sampah organik di TPA?,"Gas metana itu salah satu gas rumah kaca yang potensinya jauh lebih kuat dari karbon dioksida dalam memerangkap panas di atmosfer. Jadi, kontribusinya terhadap pemanasan global cukup signifikan."
Bagaimana cara paling efektif untuk mengurangi sampah plastik sekali pakai?,"Cara paling efektif adalah dengan menerapkan prinsip ""Refuse"" (menolak) dan ""Reduce"" (mengurangi) dari awal. Selalu bawa alternatif yang bisa dipakai ulang seperti tas belanja kain, botol minum, dan wadah makanan sendiri."
Apakah semua sampah kertas bisa didaur ulang?,"Sebagian besar kertas bisa didaur ulang, seperti koran, majalah, kardus. Tapi kertas yang sudah kotor banget (misalnya kena minyak), kertas thermal (struk ATM/kasir), atau kertas berlapis plastik biasanya sulit atau tidak bisa didaur ulang."
"Apa yang dimaksud ""nilai ekonomi tinggi"" pada sampah daur ulang yang bersih dan terpilah?","Artinya, sampah daur ulang yang sudah bersih dan dipilah sesuai jenisnya (misalnya botol PET, kaleng aluminium) lebih diminati oleh industri daur ulang dan harganya lebih mahal dibandingkan sampah yang masih kotor dan tercampur."
"Selain kompos, apa lagi cara memanfaatkan sampah sisa makanan di rumah?","Selain dikomposkan, sisa makanan tertentu (yang belum basi dan aman) bisa diolah jadi pakan ternak (kalau punya). Beberapa juga bisa diolah jadi eco-enzyme. Yang penting, jangan langsung dibuang ke tempat sampah tercampur."
Apakah EcoSortify bisa diakses oleh siapa saja?,Tentu! EcoSortify dirancang untuk membantu siapa saja yang ingin belajar lebih banyak tentang pengelolaan sampah dan meningkatkan kesadaran lingkungannya.
Apa pesan utama yang ingin disampaikan terkait pengelolaan sampah dalam dokumen ini?,"Pesan utamanya adalah pentingnya kita semua untuk lebih sadar dan bertanggung jawab dalam mengelola sampah. Mulai dari memilah dengan benar, menerapkan 3R (Reduce, Reuse, Recycle), hingga memahami dampak sampah bagi lingkungan agar kita bisa hidup lebih selaras dengan alam."
